positionlabel,position
"Minister of State in the Ministry of Finance, Economic Affairs and Planning",Q114675991
"Minister of State in the Ministry of Foreign Affairs, International Business and Diaspora",Q114676002
Minister of State in the Office of the Prime Minister with Responsibility for Telecommunications and Broadcasting,Q114676025
"Parliamentary Secretary in the Ministry of Health, Wellness and New Health Investment, with particular responsibility for Community and Home Care",Q114676039
"Parliamentary Secretary in the Ministry of Tourism, International Transport, and Maritime Initiatives, with special responsibility for Air and Sea Port Operations",Q114676049
